{
  "$schema": "https://json-schema.org/draft/2020-12/schema",
  "$id": "https://autocontext.dev/schema/harness-optimization/candidate-evidence.json",
  "title": "CandidateEvidence",
  "description": "Canonical evidence record for a single harness-optimization candidate (AC-876). A candidate is a proposed mechanism change to some target surface, carrying the hypothesis, the concrete changes, the fix and regression cases it is expected to move, its cost expectation, and its cross-language parity status. This schema is the single source of truth for both the Python and TypeScript autocontext packages.",
  "type": "object",
  "additionalProperties": false,
  "required": [
    "schema_version",
    "candidate_id",
    "mechanism_name",
    "mechanism_type",
    "target_surface",
    "hypothesis",
    "changes",
    "validation_plan",
    "parity"
  ],
  "properties": {
    "schema_version": {
      "type": "integer",
      "const": 1,
      "description": "Schema version for forward compatibility. Always 1 for this revision."
    },
    "candidate_id": {
      "type": "string",
      "minLength": 1,
      "description": "Stable unique identifier for this candidate."
    },
    "parent_frontier_id": {
      "type": "string",
      "description": "Identifier of the frontier this candidate descends from. May be empty for a root candidate."
    },
    "mechanism_name": {
      "type": "string",
      "minLength": 1,
      "description": "Human-readable name of the mechanism this candidate changes."
    },
    "mechanism_type": {
      "type": "string",
      "enum": [
        "deterministic_code",
        "prompt_playbook",
        "tool_wrapper",
        "context_policy",
        "judge_policy",
        "mixed"
      ],
      "description": "Category of mechanism being changed."
    },
    "target_surface": {
      "type": "string",
      "enum": [
        "prompt",
        "tool",
        "harness_validator",
        "runtime_adapter",
        "artifact_landing",
        "evaluator",
        "routing",
        "docs"
      ],
      "description": "The surface of the harness this candidate targets."
    },
    "hypothesis": {
      "type": "string",
      "minLength": 1,
      "description": "The falsifiable claim about why this change should help."
    },
    "changes": {
      "type": "string",
      "minLength": 1,
      "description": "Description of the concrete changes this candidate makes."
    },
    "changed_artifacts": {
      "type": "array",
      "items": { "type": "string" },
      "description": "Paths or identifiers of the artifacts this candidate modifies."
    },
    "fix_cases": {
      "type": "array",
      "items": { "type": "string" },
      "description": "Named seeds, tasks, or traces this candidate is expected to improve."
    },
    "regression_cases": {
      "type": "array",
      "items": { "type": "string" },
      "description": "Named seeds, tasks, or traces this candidate is expected to keep flat."
    },
    "observed": {
      "type": "string",
      "description": "Smoke, replay, or dry-run evidence gathered so far. May be empty at proposal time."
    },
    "validation_plan": {
      "type": "string",
      "minLength": 1,
      "description": "How this candidate will be validated before promotion."
    },
    "cost_expectation": {
      "type": "object",
      "additionalProperties": false,
      "properties": {
        "extra_tokens": {
          "type": "integer",
          "minimum": 0,
          "description": "Expected additional tokens per run."
        },
        "extra_calls": {
          "type": "integer",
          "minimum": 0,
          "description": "Expected additional model or tool calls per run."
        },
        "extra_seconds": {
          "type": "number",
          "minimum": 0,
          "description": "Expected additional wall-clock seconds per run."
        }
      },
      "description": "Expected marginal cost of adopting this candidate."
    },
    "leakage_scope": {
      "type": "array",
      "items": { "type": "string" },
      "description": "What data the proposer was allowed to inspect, for leakage auditing."
    },
    "parity": {
      "type": "object",
      "additionalProperties": false,
      "required": ["python", "typescript", "schema_hash"],
      "properties": {
        "python": {
          "type": "string",
          "enum": ["implemented", "pending", "n_a"],
          "description": "Implementation status of this candidate in the Python package."
        },
        "typescript": {
          "type": "string",
          "enum": ["implemented", "pending", "n_a"],
          "description": "Implementation status of this candidate in the TypeScript package."
        },
        "schema_hash": {
          "type": "string",
          "description": "Content hash of the shared schema the two implementations agree on."
        }
      },
      "description": "Cross-language parity status for this candidate."
    }
  }
}
